[
 {
  "question_id": "pyq-jee-main-2024-apr04-s1-phy-031",
  "exam": "JEE Main",
  "year": 2024,
  "session": "April 2024",
  "shift": "Shift 1 (4 Apr 2024)",
  "subject": "Physics",
  "chapter": "Oscillations and Waves",
  "concept_ids": [
   "jee-physics-oscillations-and-waves-chapter"
  ],
  "concept_mapping_note": "MCQ; stationary-wave equation dimensional check: NOT-correct statement identification. Filed under true chapter Waves. Chapter-level mapping; sub-concept taxonomy pending. Filed under the merged syllabus chapter (mirror splits Waves/Oscillations).",
  "question_type": "MCQ",
  "paper_question_number": 31,
  "nta_question_id": null,
  "marks": 4,
  "marks_basis": "Physics Section A, +4/-1 per the NTA Information Bulletin/FAQ for JEE Main 2024",
  "question_summary": "Dimensional correctness in a stationary-wave equation.",
  "source_url": "https://jeeprep.app/pyq/2024-apr-4-shift-1/physics",
  "source_document": "NTA JEE Main 2024, B Tech 4 Apr 2024 (third-party transcription of the official paper; direct NTA PDF login-walled)",
  "verification_status": "verified",
  "verification_method": "Human visual read of the third-party transcription (JEEPrep mirror of the official NTA paper); identity (year/session/shift/number) confirmed from page metadata; marking confirmed from the NTA Information Bulletin/FAQ; numerical answers independently recomputed and matched. Source is labeled transcription, never represented as an NTA PDF. Concept mapping is chapter-level; sub-concept taxonomy pending for these chapters.",
  "content_fingerprint": "ba4311dae86f423b",
  "difficulty": null,
  "answer_key": null,
  "provenance": {
   "retrieved_at": "2026-10-06",
   "parser": "build_transcribed_index.py v1",
   "pdf_sha256": null
  }
 }
]